{
  "schema_version": "workflow_graph.v1",
  "workflow_id": "imported_1df90e93-4b0",
  "name": "Imported 1df90e93-4b0",
  "nodes": [
    {
      "id": "node_0",
      "component_type": "io/input",
      "params": {},
      "ui_meta": {
        "position": {
          "x": 750,
          "y": -510
        }
      }
    },
    {
      "id": "node_1",
      "component_type": "math_space/ultrametric_attention",
      "params": {},
      "ui_meta": {
        "position": {
          "x": 885,
          "y": 75
        }
      }
    },
    {
      "id": "node_4",
      "component_type": "linear_algebra/moe_2expert",
      "params": {},
      "ui_meta": {
        "position": {
          "x": 900,
          "y": 210
        }
      }
    },
    {
      "id": "node_out",
      "component_type": "io/output_head",
      "params": {},
      "ui_meta": {
        "position": {
          "x": 810,
          "y": 1050
        }
      }
    },
    {
      "id": "aria_ffn_up_d416",
      "component_type": "linear_proj_up",
      "params": {
        "out_dim": 1024
      },
      "ui_meta": {
        "position": {
          "x": 480,
          "y": 75
        }
      }
    },
    {
      "id": "aria_act_d174",
      "component_type": "gelu",
      "params": {},
      "ui_meta": {
        "position": {
          "x": 540,
          "y": 225
        }
      }
    },
    {
      "id": "n_101",
      "component_type": "difficulty_scorer",
      "params": {},
      "ui_meta": {
        "position": {
          "x": 735,
          "y": -360
        }
      }
    },
    {
      "id": "n_102",
      "component_type": "lane_router",
      "params": {},
      "ui_meta": {
        "position": {
          "x": 735,
          "y": -210
        }
      }
    },
    {
      "id": "n_105",
      "component_type": "conditional_dispatch",
      "params": {},
      "ui_meta": {
        "position": {
          "x": 720,
          "y": -90
        }
      }
    },
    {
      "id": "n_106",
      "component_type": "conditional_gather",
      "params": {},
      "ui_meta": {
        "position": {
          "x": 765,
          "y": 540
        }
      }
    },
    {
      "id": "n_107",
      "component_type": "gelu",
      "params": {},
      "ui_meta": {
        "position": {
          "x": 900,
          "y": 345
        }
      }
    },
    {
      "id": "n_108",
      "component_type": "layernorm_pre",
      "params": {},
      "ui_meta": {
        "position": {
          "x": 780,
          "y": 690
        }
      }
    },
    {
      "id": "n_109",
      "component_type": "low_rank_proj",
      "params": {},
      "ui_meta": {
        "position": {
          "x": 720,
          "y": 885
        }
      }
    }
  ],
  "edges": [
    {
      "id": "e_1_4",
      "source": "node_1",
      "target": "node_4",
      "source_port": "y",
      "target_port": "x"
    },
    {
      "id": "xy-edge__node_0y-n_101x",
      "source": "node_0",
      "target": "n_101",
      "source_port": "y",
      "target_port": "x"
    },
    {
      "id": "xy-edge__n_101y-n_102x",
      "source": "n_101",
      "target": "n_102",
      "source_port": "y",
      "target_port": "x"
    },
    {
      "id": "xy-edge__n_102y-n_105x",
      "source": "n_102",
      "target": "n_105",
      "source_port": "y",
      "target_port": "x"
    },
    {
      "id": "xy-edge__n_105y-aria_ffn_up_d416x",
      "source": "n_105",
      "target": "aria_ffn_up_d416",
      "source_port": "y",
      "target_port": "x"
    },
    {
      "id": "xy-edge__n_105y-node_1x",
      "source": "n_105",
      "target": "node_1",
      "source_port": "y",
      "target_port": "x"
    },
    {
      "id": "xy-edge__aria_ffn_up_d416y-aria_act_d174x",
      "source": "aria_ffn_up_d416",
      "target": "aria_act_d174",
      "source_port": "y",
      "target_port": "x"
    },
    {
      "id": "xy-edge__node_4y-n_107x",
      "source": "node_4",
      "target": "n_107",
      "source_port": "y",
      "target_port": "x"
    },
    {
      "id": "xy-edge__n_107y-n_106b",
      "source": "n_107",
      "target": "n_106",
      "source_port": "y",
      "target_port": "b"
    },
    {
      "id": "xy-edge__aria_act_d174y-n_106a",
      "source": "aria_act_d174",
      "target": "n_106",
      "source_port": "y",
      "target_port": "a"
    },
    {
      "id": "xy-edge__n_106y-n_108x",
      "source": "n_106",
      "target": "n_108",
      "source_port": "y",
      "target_port": "x"
    },
    {
      "id": "xy-edge__n_108y-n_109x",
      "source": "n_108",
      "target": "n_109",
      "source_port": "y",
      "target_port": "x"
    },
    {
      "id": "xy-edge__n_109y-node_outx",
      "source": "n_109",
      "target": "node_out",
      "source_port": "y",
      "target_port": "x"
    }
  ],
  "metadata": {
    "discovery_loss_ratio": 0.6293073693998275,
    "experiment_id": "d71897cb-a58",
    "graph_fingerprint": "23a9c75ef7ee1da6",
    "loss_ratio": 0.01411523775257376,
    "model_dim": 256,
    "novelty_score": 0.8001494407653809,
    "result_id": "1df90e93-4b0",
    "source": "research_import",
    "validation_loss_ratio": 0.0137816688662672
  }
}