{
  "schema_version": "workflow_graph.v1",
  "workflow_id": "wf_reference_rwkv",
  "name": "RWKV Reference",
  "nodes": [
    {"id": "n_input", "component_type": "data_io/random_data_source", "params": {"batch_size": 2, "seq_len": 16, "feature_dim": 256}, "ui_meta": {"position": {"x": 300, "y": 40}}},
    {"id": "n_ln1", "component_type": "normalization/rmsnorm", "params": {}, "ui_meta": {"position": {"x": 300, "y": 140}}},
    {"id": "n_time_mix", "component_type": "mixing/rwkv_time_mixing", "params": {}, "ui_meta": {"position": {"x": 300, "y": 240}}},
    {"id": "n_res1", "component_type": "math/add", "params": {}, "ui_meta": {"position": {"x": 500, "y": 340}}},
    {"id": "n_ln2", "component_type": "normalization/rmsnorm", "params": {}, "ui_meta": {"position": {"x": 300, "y": 440}}},
    {"id": "n_channel_mix", "component_type": "channel_mixing/rwkv_channel", "params": {}, "ui_meta": {"position": {"x": 300, "y": 540}}},
    {"id": "n_res2", "component_type": "math/add", "params": {}, "ui_meta": {"position": {"x": 500, "y": 640}}},
    {"id": "n_out", "component_type": "structural/multi_head_mix", "params": {"n_heads": 8}, "ui_meta": {"position": {"x": 300, "y": 740}}}
  ],
  "edges": [
    {"id": "e1", "source": "n_input", "source_port": "data", "target": "n_ln1", "target_port": "x"},
    {"id": "e2", "source": "n_ln1", "source_port": "y", "target": "n_time_mix", "target_port": "x"},
    {"id": "e3", "source": "n_time_mix", "source_port": "y", "target": "n_res1", "target_port": "a"},
    {"id": "e4", "source": "n_input", "source_port": "data", "target": "n_res1", "target_port": "b"},
    {"id": "e5", "source": "n_res1", "source_port": "y", "target": "n_ln2", "target_port": "x"},
    {"id": "e6", "source": "n_ln2", "source_port": "y", "target": "n_channel_mix", "target_port": "x"},
    {"id": "e7", "source": "n_channel_mix", "source_port": "y", "target": "n_res2", "target_port": "a"},
    {"id": "e8", "source": "n_res1", "source_port": "y", "target": "n_res2", "target_port": "b"},
    {"id": "e9", "source": "n_res2", "source_port": "y", "target": "n_out", "target_port": "x"}
  ]
}
