{
  "schema_version": "workflow_graph.v1",
  "workflow_id": "wf_example_transformer_mini",
  "name": "Transformer Mini",
  "nodes": [
    {"id": "n_input", "component_type": "io/input",                    "params": {"dim": 128, "vocab_size": 32000},         "ui_meta": {"position": {"x": 300, "y": 40}}},
    {"id": "n_attn",  "component_type": "mixing/softmax_attention",    "params": {},                                         "ui_meta": {"position": {"x": 160, "y": 180}}},
    {"id": "n_add1",  "component_type": "math/add",                    "params": {},                                         "ui_meta": {"position": {"x": 300, "y": 320}}},
    {"id": "n_norm1", "component_type": "normalization/rmsnorm_pre",   "params": {},                                         "ui_meta": {"position": {"x": 300, "y": 450}}},
    {"id": "n_mlp",   "component_type": "channel_mixing/swiglu_mlp",   "params": {},                                         "ui_meta": {"position": {"x": 160, "y": 580}}},
    {"id": "n_add2",  "component_type": "math/add",                    "params": {},                                         "ui_meta": {"position": {"x": 300, "y": 710}}},
    {"id": "n_norm2", "component_type": "normalization/rmsnorm_pre",   "params": {},                                         "ui_meta": {"position": {"x": 300, "y": 840}}},
    {"id": "n_out",   "component_type": "io/output_head",              "params": {"vocab_size": 32000, "tie_weights": true},  "ui_meta": {"position": {"x": 300, "y": 970}}}
  ],
  "edges": [
    {"id": "e1", "source": "n_input", "source_port": "y", "target": "n_attn",  "target_port": "x"},
    {"id": "e2", "source": "n_input", "source_port": "y", "target": "n_add1",  "target_port": "a"},
    {"id": "e3", "source": "n_attn",  "source_port": "y", "target": "n_add1",  "target_port": "b"},
    {"id": "e4", "source": "n_add1",  "source_port": "y", "target": "n_norm1", "target_port": "x"},
    {"id": "e5", "source": "n_norm1", "source_port": "y", "target": "n_mlp",   "target_port": "x"},
    {"id": "e6", "source": "n_norm1", "source_port": "y", "target": "n_add2",  "target_port": "a"},
    {"id": "e7", "source": "n_mlp",   "source_port": "y", "target": "n_add2",  "target_port": "b"},
    {"id": "e8", "source": "n_add2",  "source_port": "y", "target": "n_norm2", "target_port": "x"},
    {"id": "e9", "source": "n_norm2", "source_port": "y", "target": "n_out",   "target_port": "x"}
  ]
}
