{
  "schema_version": "workflow_graph.v1",
  "workflow_id": "wf_pred_c",
  "name": "Predator C \u2014 SwiGLU Fast + RWKV Hard + Bottleneck Compress",
  "metadata": {
    "family": "predator"
  },
  "nodes": [
    {
      "id": "in",
      "component_type": "io/input",
      "params": {
        "dim": 256,
        "vocab_size": 32000
      },
      "ui_meta": {
        "position": {
          "x": 440,
          "y": 0
        }
      }
    },
    {
      "id": "norm0",
      "component_type": "linear_algebra/rmsnorm",
      "params": {},
      "ui_meta": {
        "position": {
          "x": 440,
          "y": 0
        }
      }
    },
    {
      "id": "split",
      "component_type": "structural/split2",
      "params": {},
      "ui_meta": {
        "position": {
          "x": 440,
          "y": 0
        }
      }
    },
    {
      "id": "f_swi",
      "component_type": "channel_mixing/swiglu_mlp",
      "params": {},
      "ui_meta": {
        "position": {
          "x": 140,
          "y": 0
        }
      }
    },
    {
      "id": "f_sp",
      "component_type": "linear_algebra/nm_sparse_linear",
      "params": {},
      "ui_meta": {
        "position": {
          "x": 140,
          "y": 0
        }
      }
    },
    {
      "id": "h_rwkv",
      "component_type": "mixing/rwkv_time_mixing",
      "params": {},
      "ui_meta": {
        "position": {
          "x": 740,
          "y": 0
        }
      }
    },
    {
      "id": "h_norm",
      "component_type": "linear_algebra/rmsnorm",
      "params": {},
      "ui_meta": {
        "position": {
          "x": 740,
          "y": 0
        }
      }
    },
    {
      "id": "h_sp",
      "component_type": "linear_algebra/nm_sparse_linear",
      "params": {},
      "ui_meta": {
        "position": {
          "x": 740,
          "y": 0
        }
      }
    },
    {
      "id": "h_act",
      "component_type": "math/silu",
      "params": {},
      "ui_meta": {
        "position": {
          "x": 740,
          "y": 0
        }
      }
    },
    {
      "id": "cat",
      "component_type": "structural/concat",
      "params": {},
      "ui_meta": {
        "position": {
          "x": 440,
          "y": 0
        }
      }
    },
    {
      "id": "comp",
      "component_type": "math_space/bottleneck_proj",
      "params": {},
      "ui_meta": {
        "position": {
          "x": 440,
          "y": 0
        }
      }
    },
    {
      "id": "norm1",
      "component_type": "linear_algebra/rmsnorm",
      "params": {},
      "ui_meta": {
        "position": {
          "x": 440,
          "y": 0
        }
      }
    },
    {
      "id": "res",
      "component_type": "math/add",
      "params": {},
      "ui_meta": {
        "position": {
          "x": 440,
          "y": 0
        }
      }
    },
    {
      "id": "out",
      "component_type": "io/output_head",
      "params": {
        "vocab_size": 32000
      },
      "ui_meta": {
        "position": {
          "x": 440,
          "y": 0
        }
      }
    }
  ],
  "edges": [
    {
      "id": "e_in_norm0",
      "source": "in",
      "source_port": "y",
      "target": "norm0",
      "target_port": "x"
    },
    {
      "id": "e_norm0_split",
      "source": "norm0",
      "source_port": "y",
      "target": "split",
      "target_port": "x"
    },
    {
      "id": "e_split_f_swi",
      "source": "split",
      "source_port": "y",
      "target": "f_swi",
      "target_port": "x"
    },
    {
      "id": "e_f_swi_f_sp",
      "source": "f_swi",
      "source_port": "y",
      "target": "f_sp",
      "target_port": "x"
    },
    {
      "id": "e_split_h_rwkv",
      "source": "split",
      "source_port": "y",
      "target": "h_rwkv",
      "target_port": "x"
    },
    {
      "id": "e_h_rwkv_h_norm",
      "source": "h_rwkv",
      "source_port": "y",
      "target": "h_norm",
      "target_port": "x"
    },
    {
      "id": "e_h_norm_h_sp",
      "source": "h_norm",
      "source_port": "y",
      "target": "h_sp",
      "target_port": "x"
    },
    {
      "id": "e_h_sp_h_act",
      "source": "h_sp",
      "source_port": "y",
      "target": "h_act",
      "target_port": "x"
    },
    {
      "id": "e_f_sp_cat",
      "source": "f_sp",
      "source_port": "y",
      "target": "cat",
      "target_port": "a"
    },
    {
      "id": "e_h_act_cat",
      "source": "h_act",
      "source_port": "y",
      "target": "cat",
      "target_port": "b"
    },
    {
      "id": "e_cat_comp",
      "source": "cat",
      "source_port": "y",
      "target": "comp",
      "target_port": "x"
    },
    {
      "id": "e_comp_norm1",
      "source": "comp",
      "source_port": "y",
      "target": "norm1",
      "target_port": "x"
    },
    {
      "id": "e_norm1_res",
      "source": "norm1",
      "source_port": "y",
      "target": "res",
      "target_port": "a"
    },
    {
      "id": "e_in_res",
      "source": "in",
      "source_port": "y",
      "target": "res",
      "target_port": "b"
    },
    {
      "id": "e_res_out",
      "source": "res",
      "source_port": "y",
      "target": "out",
      "target_port": "x"
    }
  ]
}